{
  "event_id": "evt_03",
  "type": "call.ended",
  "occurred_at": "2026-09-15T11:04:00+02:00",
  "organization_id": "org_demo_a",
  "idempotency_key": "lk-out-0307",
  "delivery_attempt": 1,
  "campaign": {
    "system_key": "first_touch_voice",
    "entry_id": "ce_0307"
  },
  "lead": {
    "contact_id": "c_307",
    "phone": "+34600000107",
    "full_name": "Elena Vaquero",
    "lead_source": "idealista",
    "property_ref": "RIB-1904",
    "property_address": "avenida de Europa 44, Pozuelo de Alarcón",
    "language": "es"
  },
  "telephony": {
    "provider": "livekit_sip",
    "call_id": "lk-out-0307",
    "provider_call_id": "0307-telnyx",
    "dialed_at": "2026-09-15T11:03:35+02:00",
    "ringing_at": "2026-09-15T11:03:37+02:00",
    "answered_at": "2026-09-15T11:03:41+02:00",
    "ended_at": "2026-09-15T11:04:00+02:00",
    "sip_status_code": 200,
    "sip_status": "OK",
    "disconnect_reason": "CLIENT_INITIATED",
    "hung_up_by": "callee",
    "duration_seconds": 19,
    "amd": {
      "result": "human",
      "greeting_transcript": "¿Sí? ¿Quién es?",
      "detected_at_secs": 1.9,
      "source": "livekit_amd"
    }
  },
  "transcript": [
    {
      "role": "agent",
      "message": "Hola, buenas. ¿Hablo con Elena? Te llamo de parte de Ribera Inmobiliaria.",
      "time_in_call_secs": 3
    },
    {
      "role": "user",
      "message": "Aquí no vive ninguna Elena. Se ha equivocado.",
      "time_in_call_secs": 8
    },
    {
      "role": "agent",
      "message": "Ah, perdona. ¿Sabrías decirme si este número es de alguien más?",
      "time_in_call_secs": 11
    },
    {
      "role": "user",
      "message": "No, no. Este número es mío de toda la vida. Que no.",
      "time_in_call_secs": 15
    },
    {
      "role": "agent",
      "message": "Entendido, disculpa la molestia. Buen día.",
      "time_in_call_secs": 18
    }
  ],
  "agent_outcome": {
    "appointment": null,
    "slots_snapshot": {}
  },
  "recording": {
    "gcs_path": "gs://kontaktu-demo/org_demo_a/2026-09/lk-out-0307.ogg",
    "duration_seconds": 19
  },
  "metrics": {
    "turns": 5,
    "ttft_ms_p50": 991
  }
}
